{
  "transcript": "Nope.",
  "expected_step_context": "any",
  "condition_tags": [
    "short-answer",
    "quiet-room"
  ],
  "speaker_notes": "SYNTHETIC PLACEHOLDER (2026-04-21). Generated via OpenAI gpt-4o-mini-tts, voice='shimmer'. NOT human speech; WER / VAD metrics from this clip are not representative of production. Replace with a real human recording per INDEX.md capture methodology before the US-021 / US-029 decision.",
  "sample_rate": 16000,
  "duration_sec": 1.5
}
