{
  "transcript": "Could you say that again please.",
  "expected_step_context": "any",
  "condition_tags": [
    "short-phrase",
    "hvac-noise"
  ],
  "speaker_notes": "SYNTHETIC PLACEHOLDER (2026-04-21). Generated via OpenAI gpt-4o-mini-tts, voice='alloy', overlay='hvac'. NOT human speech; WER / VAD metrics from this clip are not representative of production. Replace with a real human recording per INDEX.md capture methodology before the US-021 / US-029 decision.",
  "sample_rate": 16000,
  "duration_sec": 3.2
}
