{
  "transcript": "The feeling is like a low hum that sits behind everything I do, and it gets louder whenever I try to slow down or sit still, and I notice it most in the evenings.",
  "expected_step_context": "problem",
  "condition_tags": [
    "long-utterance",
    "mid-utterance-pause",
    "quiet-room"
  ],
  "speaker_notes": "SYNTHETIC PLACEHOLDER (2026-04-21). Generated via OpenAI gpt-4o-mini-tts, voice='alloy', 700ms mid-clip pause inserted. NOT human speech; WER / VAD metrics from this clip are not representative of production. Replace with a real human recording per INDEX.md capture methodology before the US-021 / US-029 decision.",
  "sample_rate": 16000,
  "duration_sec": 12.5
}
