{
  "transcript": "There is a part of me that wants to rest, and a part of me that thinks I do not deserve to rest until I have earned it, and those two voices argue all day.",
  "expected_step_context": "problem",
  "condition_tags": [
    "long-utterance",
    "mid-utterance-pause",
    "quiet-room"
  ],
  "speaker_notes": "SYNTHETIC PLACEHOLDER (2026-04-21). Generated via OpenAI gpt-4o-mini-tts, voice='onyx', 700ms mid-clip pause inserted. NOT human speech; WER / VAD metrics from this clip are not representative of production. Replace with a real human recording per INDEX.md capture methodology before the US-021 / US-029 decision.",
  "sample_rate": 16000,
  "duration_sec": 11.15
}
